{"$schema":"https://raw.githubusercontent.com/nandomoreirame/amnesia-claude-code/main/schemas/amnesia-entity.schema.json","entity":"amnesia-claude-code","permanent_facts":{"metadata":{"type":"claude-code-plugin","language":"python","framework":"pydantic-v2","test_framework":"pytest","repo":"github.com/nandomoreirame/amnesia-claude-code","license":"MIT"},"items":["Deterministic memory operations via Python CLI (amnesia.py)","Commands .md are thin orchestrators, Claude handles semantic work","Entity memory stored as JSON in .claude/amnesia/memory/","Session logs stored in .claude/amnesia/sessions/","Schema migration from etl-client-memory-v1 to amnesia-entity","Native MEMORY.md integration via scripts/native_memory.py (read-only)","amnesia.py never writes to native memory, Claude does via commands","Mapping: current_status to project, decisions to feedback, metadata to reference","items and technical_notes are NOT synced to native memory (REQ-024)","Index limit warning at 180 lines (native truncates at 200)"]},"decisions":[{"date":"2026-04-03","author":"user","decision":"amnesia.py only reads native memory; writing delegated to Claude via its native memory mechanism"},{"date":"2026-04-03","author":"user","decision":"Bidirectional sync: amnesia reads native context on load, Claude writes native after save"},{"date":"2026-04-03","author":"user","decision":"Selective mapping: status->project, decisions->feedback, metadata->reference; items and notes excluded"}],"current_status":{"phase":"native-memory-sync implemented","tracker_ids":[],"blockers":[]},"last_session":{},"technical_notes":["75 tests passing (34 native_memory + 41 existing)","sync subcommand needs --project-root on its own subparser (argparse quirk)","_parse_frontmatter uses simple key:value parsing, not full YAML library"],"updated_at":"2026-04-03T16:36:56Z"}